Sheet: Sheet1
A1: latlong longitude left | B1: 20.7428817 | D1: google spherical mercator units per degree of longitude | E1: google spherical mercator left coordinate | F1: of:=[.B1]*[.$D$2] -> 2309087.02842911
A2: latlong longitude right | B2: 21.8133242 | D2: of:=2*PI()*[.D9]/360 -> 111319.490793274 | E2: google spherical mercator right coordinate | F2: of:=[.B2]*[.$D$2] -> 2428248.14245259
A3: latlong latitude down | B3: 45.4255187 | D3: google spherical mercator units per degree of latitude | E3: google spherical mercator down coordinate | F3: of:=[.B3]*[.$D$4] -> 5056745.61070433
A4: latlong latitude up | B4: 46.0681176 | D4: of:=PI()*[.D9]/180 -> 111319.490793274 | E4: google spherical mercator up coordinate | F4: of:=[.B4]*[.$D$4] -> 5128279.39303665
B5: input | D5: formula | F5: output
D8: earth radius in google mercator
D9: 6378137
D10: constant